متن وصیتنامه,شماره متن,شماره صوت,صفحه
 ومسلمو العراق والكوفة اولئك الذين صنعوا مع سيد الشهداء ما صنعوا واولئك الذين لم يلطخوا ايديهم بدم شهادته،اما أنهم هربوا من المعركة أو قعدوا فكانت جناية التاريخ تلك...,138,138,28
 اما اليوم، فاننا نرى ان شعب ايران بدءً بالقوى المسلحة، من الجيش والامن الداخلي والحرس والتعبئة، الى القوى الشعبية من العشائر والمتطوعين، والقوى التي في الجبهة،,139,139,28
 والناس المحترمين خلف الجبهة - بكل شوق ولهفة - ايّة تضحيات يضحون، واية ملاحم يسطرون .. ونرى أن الناس المحترمين في جميع انحاء البلاد اية معونات قيّمة يقدمون.,140,140,28
 ونرى عوائل الشهداء ومتضرري الحرب وذويهم يلاقوننا واياكم بوجوه صانعة للملاحم، واقوال وافعال ملؤها الشوق، وتَهَب الاطمئنان . ,141,141,29
 ومبعث كل ذلك عشقهم وحبهم، وايمانهم التام بالله المتعال والاسلام والحياة الخالدة، في حين أنهم ليسوا في محضر رسول الله - صلى الله عليه وآله - المبارك، ولا في محضر الامام المعصوم - صلوات الله عليه - ولا بين يديه، ودافعهم هو الايمان والاطمئنان بالغيب، وهذا سر التوفيق والنصر في الابعاد المختلفة . ,142,142,29
وينبغي ان يفتخر الاسلام انه ربى مثل هؤلاء الابناء، ونحن كلنا فخورون لأننا فى عصركهذا وعلى اعتاب شعب كهذا ... . ,143,143,29
 نصيحة مشفقة للمعارضين ,144,144,29
 وان لي هنا وصية الى الاشخاص الذين يعارضون الجمهورية الاسلامية بدوافع مختلفة، والى الشباب - سواء الفتيات او الفتيان الذين يستغلهم المنافقون والمنحرفون والانتهازيون والنفعيون - ان يفكروا بحرية وحياد فى دعايات اولئك الذين يريدون ان تسقط الجمهورية الاسلامية،,145,145,29
" وكيفية عملهم وسلوكهم مع الجماهير المحرومة والفئات والدول التي ساندتهم وتساندهم, والاشخاص الذين التحقوا بهم في الداخل ويدعمونهم، واخلاقهم وسلوكهم فيما بينهم ومع مؤيديهم، وتغيير مواقفهم في المستجدات المختلفة.",146,146,30
 ابحثوا في ذلك بدقة وبعيدا عن اهواء النفس … وتأملوا اوضاع اولئك الذين استشهدوا في الجمهورية الاسلامية على يد المنافقين والمنحرفين، وقارنوا بينهم وبين اعدائهم … اشرطة تسجيل هؤلاء الشهداء - الى حد..ما - هي بمتناول ايديكم، واشرطة معارضيهم لعلها بمتناول ايديكم ...انظروا اي فريق يناصرالمحرومين والمظلومين في المجتمع .,147,147,30
 ايها الاخوة...انتم لاتقرؤون هذة الاوراق قبل وفاتي بل قد تقرؤونها بعدي، انذاك لن اكون عندكم حتى يكون هدفي التلاعب بقلوبكم الشابة لصالحي، وجلب اهتمامكم لكسب الموقع والسلطة.,148,148,30
 انني - ولاجل انكم شبان لائقون - احب ان تصرفو شبابكم في سبيل الله والاسلام العزيز والجمهورية الاسلامية، حتى تفوزوا بسعادة الدارين . واسال الله الغفور ان يهديكم الى طريق الانسانية المستقيم ويعفو عن ماضينا وماضيكم برحمته الواسعة... انتم ايضا اطلبوا ذلك من الله في الخلوات انه الهادي والرحمن .  ,149,149,30
 وصية للشعوب ,150,150,30
 ولي وصية الى شعب ايران الشريف، وسائر الشعوب المبتلاة بالحكومات الفاسد والاسيرة للقوى الكبرى: اما وصيتي الى شعب ايران العزيز،فهي ان تحفظوا وتحرسوا النعمة التي حصلتم عليها بجهادكم العظيم ودم شبانكم الراشدين،,151,151,31
 اعرفوا قدرها كاعز مالديكم وابذلوا الجهد من اجلها فهي النعمة الالهية العظيمة، والامانة الالهية الكبيرة، ولا تخافوا من المشكلات التي تواجهكم في هذا الصراط المستقيم، فان تنصروا الله ينصركم ويثبت اقدامكم،,152,152,31
 وكونوا شركاء فى تحمل صعوبات حكومة الجمهورية الاسلامية، واعملوا على تجاوزهذه الصعوبات بالروح والقلب ... واعتبروا الحكومة والمجلس منكم وحافظوا عليها كما تحافظون على محبوب عزيز... ,153,153,31
 واوصي المجلس والحكومة، وكل المعنيين ان :اعرفوا قدرهذا الشعب، ولا تقصّروا فى خدمته خصوصاً المستضعفين والمحرومين والمضطهدين،الذين هم نور عيوننا واولياء نعمنا جميعا والجمهوريةالاسلامية انجازهم، وقد تحققت بتضحياتهم، وبقاؤها مرهون لخدماتهم،,154,154,31
 واعتبرو، انفسكم من الناس، والناس منكم، ارفضوا باستمرار الحكومات الطاغوتية التي لا عقل لها ولا ثقافة، ولا منطق الا البطش... طبعا بالاعمال الانسانية التى تليق بحكومة اسلامية .. ,155,155,31
 واما وصيتى الى الشعوب الاسلامية،فهي : أن اجعلوا حكومة الجمهورية الاسلامية، وشعب ايران المجاهد قدوة لكم، واذا لم تستجب حكوماتكم الجائرة لارادة الشعوب - التي هي ارادة شعب ايران - فاجبروها بكل قوة على الاستجابة لذلك، فانّ اساس شقاء المسلمين هو الحكومات المرتبطة بالشرق والغرب ..,156,156,32
 واوصي مؤكدا أن لا تستمعوا الى الابواق الاعلامية لاعداء الاسلام والجمهورية الاسلامية، فان الجميع يعملون على اخراج الاسلام من ساحة الصراع خدمةً لمصالح القوى الكبرى. ,157,157,32
 روح الله الموسوي الخميني ,158,158,32
  مؤامرة الفصل بين الحوزة والجامعة ,159,159,32
 د - من المخططات الشيطانية للقوى الاستعمارية والاستغلالية الكبرى التي يُعمل على تنفيذها منذ سنوات طويلة، وقد بلغت ذروتها فى ايران منذ عهد رضا خان وتواصل العمل لتحقيقها في عهد محمد رضا باساليب مختلفة : مخطط محاصرة الروحانية،التي عمل لها في زمن رضا خان بالضغوط والتنكيل ومحاربة الزيّ والسجن والابعاد وهتك الحرمات والاعدام وامثال ذلك...,160,160,32
 وعمل لها في زمن محمد رضا بأشكال اخرى منها: ايجاد العداوة بين الجامعيين والروحانيين، وقد بذلت جهود إعلامية واسعة النطاق في هذا المجال، وللأسف فقد حقّقت هذه االمؤامرة نتيجة ملحوظة بسبب غفلة الطرفين عن هذه المؤامرة الشيطانية للدول المتجبرة. ,161,161,33
 فمن جهة حرصوا على اختيار المعلمين والمدراء والاساتذة ورؤساء الجامعات من بين المنبهرين بالغرب او بالشرق والمنحرفين عن الاسلام وسائر الاديان، وحدوا من وجود الملتزمين والمؤمنين، لتتمكن الشريحة الاقوى من تسلم الحكم في المستقبل،,162,162,33
 وربوا الطفل والفتى والشاب بطريقة تجعلهم يشمئزون من الاديان مطلقا ومن الاسلام بالخصوص ومن اتباع الاديان وخصوصا الروحانيين المبلغين الذين وصفوهم في ذلك الوقت بانهم عملاء للانكليز. ووصفوهم بعد ذلك بانهم متحالفون مع الرأسماليين والاقطاعيين ومؤيدون للرجعية، ومعارضون للحضارة والرقي.,163,163,33
 ومن جهة اخرى زرعوا - عبر دعايات السوء - الخوف في نفوس الروحانيين المبلغين والمتدينين من الجامعة والجامعيين حتى اصبح هؤلاء يتهمون جميع اولئك باللادين والتحلل، ومعارضة شعائر الاسلام والاديان. ,164,164,33
 والنتيجة ان يصبح رجال الدولة من المعارضين للاديان والاسلام والروحانيين والمتدينين، وتصبح جماهير الشعب التي تحت الدين والروحاني معارضة للدولة والحكومة وكل ما يرتبط بها.,165,165,33
 ويفتح هذا الاختلاف يبن الحكومة والشعب، والجامعي والروحاني، الطريق رحبا امام الناهبين، بحيث تصبح جميع مقدرات البلد في قبضتهم، وجميع ذخائر الشعب تصب في جيوبهم، وقد رأيتم ما حل بهذا الشعب المظلوم، وما كان ينتظره... ,166,166,34
  الحوزة والجامعة هما العقل المدبر للامة ,167,167,34
 والان وقد تحقق - بارادة الله تعالى وجهاد الشعب من الروحاني والجامعي الى الكاسب والتاجر والعامل والفلاح، وسائر الشرائح - تحطيم قيد الاسر، وتحطيم سد قوة القوى الكبرى، وانقاذ البلد من ايديهم وايدي عملائهم. ,168,168,34
فان وصيتي الى هذا الجيل والاجيال القادمة أن لا يغفلوا وليبرم الجامعيون والشباب الراشدون الاعزاء عقد المحبة والتفاهم مع الروحانيين وطلاب العلوم الاسلامية ولا يغفلوا عن الخطط والمؤامرات الشيطانية الغادرة وبمجرد أن يروا شخصا أو اشخاصا يبذرون النفاق بينهم - بقولهم وفعلهم - فليرشدوهم ولينصحوهم، و إن لم يؤثر ذلك، فليعرضوا عنهم ويعزلوهم،,169,169,34
 ولا تدعوا المؤامرة تمتد وتتجذر، فان مصدر النبع يمكن التحكم فيه بسهولة وخصوصا، اذا وجد بين الاساتذة شخص يريد ايجاد الانحراف.. فليرشدوه، وان لم يستجب فليطردوه من بينهم ومن قاعة التدريس، وهذه التوصية موجهة بنسبة اكبر الى الروحانيين وطلاب العلوم الدينية. ,170,170,34
 وتمتاز المؤامرات في الجامعات بعمق خاص، وعلى كل من الشريحتين المحترمتين - اللتين هما عقل المجتمع المفكر - أن يحذروا المؤامرات. ,171,171,35
مصيبة التبعية للشرق والغرب ,172,172,35
 هـ - من جملة المخططات التي تركت - للأسف - اثرا كبيرا في مختلف البلاد وبلدنا العزيز - وما تزال اثارها قائمة الى حد بعيد - جعل الدول المنكوبة بالاستعمار تعيش الغربة عن هويتها لتصبح منبهرة بالغرب والشرق، بحيث إنها لا تقيم أي وزن لنفسها وثقافتها وقوتها … ,173,173,35
 وتعتبر أنّ قطبي الشرق والغرب هما العنصر المتفوق، وثقافتهما الاسمى... وهما قبلة العالم والارتباط باحدهما من الفرائض التي لا يمكن اجتنابها. وقصة هذا الامر المحزن طويلة.. والضربات التي تلقيناها من هؤلاء - وما زلنا - ضربات قاتلة ومدمرة.,174,174,35
 والأدهى من ذلك ان اولئك حرصوا على ابقاء الدول المظلومة المستعبدة متخلفة في كل شيىء.. ودولاً استهلاكية،وخوّفونا من مظاهرتقدمهم، وتقدم قدراتهم الشيطانية الى حد كبير،بحيث لم نعد نجرأ على المبادرة الى اي ابداع، وسلّمنا لهم كل شيء، واودعناهم مصيرنا وبلادنا، واغمضنا عيوننا وسددنا اذاننا، مطيعين للاوامر.,175,175,35
 وهذا الخواء والفراغ العقلي المصطنع اوجب ان لا نعمتد على فكرنا وعلمنا في أي امر، وأن نقلد الشرق والغرب تقليدا اعمى، بل كان الكتاب والخطباء الجهلة المنبهرون بالغرب والشرق - وما يزالون - ينتقدون ويسخرون من ثقافتنا وادبنا وصناعتنا واختراعنا - ان كان - ويقللون من شأن فكرنا وامكاناتنا المحلية،,176,176,36
ويزرعون فيها اليأس، ويروجون باعمالهم واقوالهم وكتاباتهم العادات والتقاليد الاجنبية،مهما كانت مبتذلة منحطة، وقد عملوا - وما يزالون - على تسويقها بين الشعوب بالمدح والثناء، وعلى سبيل المثال :اذا كان في كتاب ما او مقالة او خطابة عدة مفردات اجنبية، فانهم يقبلونها باعجاب، دون التحقيق في محتواه،ويعتبرون الكاتب اوالخطيب عالما ومثقفا.,177,177,36
 واذا لاحظنا من المهد الى اللحد، فكلما نراه اذ كان قد سمي بمفردة غربية او شرقية، فهو مرغوب، ويحظى بالاهتمام، ويعتبر من مظاهر الحضارة - اما اذا سمّي باسم محلي مما نسمي نحن - فهو مرفوض وقديم ومتخلف.,178,178,36
 اطفالنا اذا كانت اسماؤهم غربية فهم فخورون... واذا كانت محلية فهم خجلون ومتخلفون... الشوارع والازقة والمحلات والشركات والصيدليات والمكتبات العامة والاقمشة وسائر الامتعة... كلما ينتج في الداخل، فلا بد من اختيار اسم اجنبي له ليقبل الناس عليه ويرضوا به.,179,179,36
 التفرنج من الرأس الى القدم،وفي كل شيء من الجلوس والقيام، وجميع مظاهر العلاقات الاجتماعية، وجميع شؤون الحياة سبب للافتخار والاعتزاز والتمدن والرقي. ,180,180,36
وفي مقابل ذلك، فان الاداب والتقاليد المحلية رجعية وتخلف. وعند الابتلاء بمرض - ولو كان جزئيا يمكن علاجه في الداخل - يجب الذهاب الى الخارج، وإشعار دكاترتنا واطبائنا العلماء باليأس. الذهاب الى انكلترا وفرنسا - وامريكا وموسكو افتخار قيِّم، والذهاب الى الحج وسائر الاماكن المباركة رجعية وتخلف.,181,181,37
 عدم احترام ما يرتبط بالدين والمعنويات من علائم التجدد والحضارة، وفى المقابل فإن الالتزام بهذه الامور علامة التخلف والرجعية.,182,182,37
 لا اقول : اننا نمتلك كل شيء، فمن الواضح أنهم حرّمونا - طول التاريخ غير البعيد كثيرا وخصوصا في القرون الاخيرة - من كل تقدم، ورجال الحكم الخونة خصوصا اسرة بهلوي، ومراكز الدعاية ضد منجزاتنا والاحساس بالضعف او عقدة النقص،كل ذلك حرمنا من اية فعالية في سبيل التقدم.,183,183,37
 استيراد البضائع من جميع الانواع، والهاء النساء والرجال، خصوصا طبقة الشباب بانواع البضائع المستوردة، من قبيل ادوات التجميل والزينة والكماليات والالعاب الصبيانية، وجرّ الاسر إلى التنافس في الروح الاستهلاكية التي تبذل الجهود الكبيرة لتنميتها..,184,184,37
 ولهذا بالذات قصص محزنة - والهاء الشباب وجرهم الى الفساد - وهم القوة الفاعلة - عبر توفير مراكزالفحشاء ودور البغاء، وعشرات من هذه المصائب المدروسة بهدف ابقاء الدول متخلفة. ,185,185,37
 الاعتماد على الخبرات المحلية ,186,186,38
 انني اوصي الشعب العزيز، ومن منطلق الحرقة والخدمة : انكم تخلصتم الان - الى حد لافت جدا - من كثير من هذه المصائد، وقد هب الجيل الحاضر المحروم الى الفعالية والابداع، وراينا كثيرا من المعامل والوسائل المتطورة كالطائرات وغيرها، التي لم يكن يظن ان المتخصصين الايرانيين يمكنهم تشغيلها والتعامل معها...,187,187,38
 وكنا من قبل نمد ايدينا الى الشرق والغرب لياتي خبراؤهم لتشغيلها، راينا كيف ان الحصار الاقتصادي،والحرب المفروضة جعلت شبابنا يصنعون القطع التي دعت الحاجة اليها وبكلفة اقل،وكيف تمت عبر شبابنا تلبية هذه الحاجة، واثبتوا اننا اذا اردنا فاننا قادرون. ,188,188,38
 فيجب ان تراقبوا بوعي ويقظة، كي لا يجركم الساسة المتلاعبون المرتبطون بالغرب والشرق - بوساوسهم الشيطانية - نحو هؤلاء الناهبين الدوليين، وانهضوا بارادة مصممة، وفعالية ومثابرة، لرفع انواع التبعية. ,189,189,38
 واعلموا ان العنصرالاري والعربي، لايقل عن العنصر الاوروبي والامريكي والروسي، واذا وجد (العنصر الاري والعربي ) هويته الذاتية وابعد اليأس عنه، ولم يكن له مطمع بغير نفسه... فانه قادر على المدى البعيد على كل فعل، وصناعة كل شيء...,190,190,38
 وما وصل اليه الناس المشابهون لهؤلاء، فانتم ستصلون اليه بشرط الاتكال على الله، والاعتماد على النفس، وقطع التبعية للاخرين، وتحمل الصعوبات من اجل الوصول الى الحياة الشريفة والخروج من سلطة الاجانب.,191,191,39
 ويجب على الحكومات والمسؤولين - في الجيل الحاضر او في الاجيال القادمة - ان يقدروا متخصصيهم ويشجعوهم على العمل بالمساعدة المادية والمعنوية، وان يحولوا دون استيراد البضائع الاستهلاكية المدمرة ويتكيفوا بالموجود عندهم الى ان يصنعوا كل شيء. ,192,192,39
 واطلب من الشباب، البنات والبنين، ان لا يجعلوا الاستقلال والحرية والقيم الانسانية - ولو مع تحمل المشقة والالم - فداء للكماليات والاختلاط وانواع التحلل والحضور في مراكزالفحشاء التي تقدم لكم من قبل الغرب وعملائه،,193,193,39
 الذين لا وطن لهم، فان هؤلاء- كما اثبتت التجربة - لا يفكرون بغيرافسادكم واغفالكم عن مصير بلدكم، وابتلاع ذخائركم وجركم الى قيد الاستعمار وعار التبعية، وجعل شعبكم وبلدكم مستهلكين. انهم يريدون بهذه الاساليب وامثالها،ابقاءكم متخلفين - وعلى حد تعبيرهم - نصف متوحشين. ,194,194,39
 مؤامرة افساد الجامعات وحرف الشباب ,195,195,39
 و- من مؤامراتهم الكبيرة - كما تقدمت الاشارة، وذكرت مرارا - السيطرة على مراكز التعليم والتربية، خصوصا الجامعات، حيث ان مقدرات الدول بايدي علمائها. ويختلف اسلوبهم مع الروحانيين ومدارس العلوم الاسلامية عن اسلوبهم في الجامعات والثانويات.,196,196,40
 خطتهم ( في الحوزات ) ازاحة الروحانين عن الطريق، وعزلهم اما بالقمع والعنف والاهانة، كما جرى في زمان رضا خان، وكانت له نتيجة عكسية، واما بالدعايات والتهم، والخطط الشيطانية لفصل الطبقة المتعلمة او المتنورة - كما هو المصطلح – وقد جرى ذلك ايضا في زمان رضا خان، مقارنا للضغط والقمع، واستمر في زمان محمد رضا ولكن بدون عنف، انما بطريقة مؤذية.,197,197,40
 واما في الجامعة، فخطتهم حرف الشباب عن ثقافتهم وادبهم والقيم الذاتية، وجرهم نحو الشرق او الغرب، واختيار رجال الحكم من بينهم،وتحكيمهم بمصائر الدول، لينفذوا عبرهم كل ما يريدون...ويجر هؤلاء البلد الى نكبة الغارة عليه، والانبهار بالغرب، ولايكون بمستطاع شريحة الروحانيين - بسبب الانزواء والكراهية والضغط - ان يحولوا دون ذلك.,198,198,40
 وهذا افضل طريق لابقاء الدول التي تحت سيطرتهم متخلفة تواجه الغارة عليها لانه يجعل كل شيء يصب في جيوب القوى الكبرى دون عناء ولا كلفة.. ودون اية ضجّة فى المحافل الوطنية. ,199,199,40
 ان من اللازم على الجميع الان - وحيث يجري اصلاح الجامعات والمعاهد التعليمية وتطهيرها - ان نساعد المتصدين لذلك، ونحول - والى الابد - دون انحراف الجامعات، ونعمل - وبسرعة - على رفع كل انحراف نراه،ولا بد ان يتحقق هذا الامرالمهم، في المرحلة الاولى باليد المقتدرة لشباب الجامعات والمعاهد التعليمية، فان نجاة الجامعة من الانحراف نجاة للبلد والشعب.,200,200,40
 انني اوصي - جميع الفتيان والشبان اولا والآباء والامهات واصدقاءهم ثانيا، وبعد ذلك رجال الدولة والمثقفين المتحرقين على البلد ان يبذلوا الجهد من كل قلبهم وروحهم في هذا الامرالمهم الذي يحفظ بلدهم من الاذى، ويسلّموا امانة حفظ الجامعات الى الجيل القادم,201,201,41
  واوصي جميع الاجيال المتعاقبة ان يحفظوا الجامعات من الانحراف والانبهار بالغرب والشرق وصونوها نجاة لانفسكم وبلدكم العزيز والاسلام الصانع للانسان، وبعملكم الانساني الاسلامى هذا تقطعون يد القوى الكبرى عن البلد، وييؤسوهم. حفظهم الله واعانهم. ,202,202,41
  انتخبوا نوابا ملتزمين ,203,203,41
 ز - من مهمات الامور التزام نواب مجلس الشورى الاسلامى.. فنحن راينا ايّة اضرار محزنة جدا لحقت بالاسلام ودولة ايران من مجلس الشورى غير الصالح والمنحرف منذ ما بعد المشروطة (الدستورية) الى عصر االنظام البهلوي المجرم.,204,204,41
